{
  "$schema": "https://json-schema.org/draft/2020-12/schema",
  "$id": "https://talos.local/schema/browser/v1/browser-evidence-bundle.schema.json",
  "type": "object",
  "additionalProperties": false,
  "required": ["schema_version", "evidence_id", "task_id", "action_id", "worker_state_version", "url", "title", "captured_at", "frame", "snapshot_artifact_id", "screenshot_artifact_id", "before_evidence_id", "integrity_sha256", "claims"],
  "properties": {
    "schema_version": { "const": "talos.browser.evidence.v1" },
    "evidence_id": { "$ref": "#/$defs/id" },
    "task_id": { "$ref": "#/$defs/id" },
    "action_id": { "$ref": "#/$defs/id" },
    "worker_state_version": { "type": "integer", "minimum": 0, "maximum": 9007199254740991 },
    "url": { "type": "string", "format": "uri", "pattern": "^(https?://[^\\s]+|about:blank)$", "maxLength": 8192 },
    "title": { "type": "string", "maxLength": 4096 },
    "captured_at": { "$ref": "#/$defs/timestamp" },
    "frame": {
      "type": "object",
      "additionalProperties": false,
      "required": ["frame_id", "viewport_width", "viewport_height", "device_pixel_ratio", "scroll_x", "scroll_y"],
      "properties": {
        "frame_id": { "type": "string", "minLength": 1, "maxLength": 256 },
        "viewport_width": { "type": "integer", "minimum": 1, "maximum": 32768 },
        "viewport_height": { "type": "integer", "minimum": 1, "maximum": 32768 },
        "device_pixel_ratio": { "type": "number", "exclusiveMinimum": 0, "maximum": 16 },
        "scroll_x": { "type": "number", "minimum": 0, "maximum": 1000000000 },
        "scroll_y": { "type": "number", "minimum": 0, "maximum": 1000000000 }
      }
    },
    "snapshot_artifact_id": { "oneOf": [{ "$ref": "#/$defs/id" }, { "type": "null" }] },
    "screenshot_artifact_id": { "oneOf": [{ "$ref": "#/$defs/id" }, { "type": "null" }] },
    "before_evidence_id": { "oneOf": [{ "$ref": "#/$defs/id" }, { "type": "null" }] },
    "integrity_sha256": { "type": "string", "pattern": "^sha256:[a-f0-9]{64}$" },
    "claims": {
      "type": "array",
      "maxItems": 1000,
      "items": {
        "type": "object",
        "additionalProperties": false,
        "required": ["claim_id", "kind", "value", "source_artifact_id"],
        "properties": {
          "claim_id": { "type": "string", "minLength": 1, "maxLength": 256 },
          "kind": { "type": "string", "minLength": 1, "maxLength": 128 },
          "value": { "type": "string", "maxLength": 16384 },
          "source_artifact_id": { "$ref": "#/$defs/id" }
        }
      }
    }
  },
  "anyOf": [
    { "required": ["snapshot_artifact_id"], "properties": { "snapshot_artifact_id": { "$ref": "#/$defs/id" } } },
    { "required": ["screenshot_artifact_id"], "properties": { "screenshot_artifact_id": { "$ref": "#/$defs/id" } } },
    { "properties": { "claims": { "type": "array", "minItems": 1 } } }
  ],
  "$defs": {
    "id": { "type": "string", "pattern": "^(?:[0-9a-f]{8}-[0-9a-f]{4}-[0-9a-f]{4}-[89ab][0-9a-f]{3}-[0-9a-f]{12}|[0-9A-HJKMNP-TV-Z]{26})$" },
    "timestamp": { "type": "string", "format": "date-time", "pattern": "^\\d{4}-\\d{2}-\\d{2}T\\d{2}:\\d{2}:\\d{2}(?:\\.\\d+)?(?:Z|[+-]\\d{2}:\\d{2})$" }
  }
}
